государственное бюджетное образовательное учреждение начального профессионального образования Ростовской области профессиональный лицей № 37 "Донсервис"	2
государственное бюджетное учреждение Краснодарского края "Центр спортивной подготовки по гребле на байдарках и каноэ"	2
федеральное казенное лечебно-профилактическое учреждение "Республиканская больница Главного управления Федеральной службы исполнения наказаний по Республике Башкортостан"	2
Областное бюджетное учреждение здравоохранения "Золотухинская центральная районная больница" комитета здравоохранения Курской области	2
Заречное муниципальное учреждение "Дирекция единого заказчика"	2
Комитет по управлению муниципальным имуществом и земельным отношениям Администрации Октябрьского районного муниципального образования Республики Калмыкия	2
следственное управление Следственного комитета Российской Федерации по Чувашской Республике	2
Федеральное государственное бюджетное учреждение "Российский научный центр рентгенорадиологии" Министерства здравоохранения и социального развития Российской Федерации	2
Федеральное государственное бюджетное учреждение "Российский научный центр хирургии имени академика Б.В. Петровского" Российской академии медицинских наук	2
Администрация рабочего поселка (поселка городского типа) Февральск Селемджинского района Амурской области	2
государственное казенное учреждение "Главное инвестиционно-строительное управление Республики Татарстан"	2
федеральное государственное бюджетное учреждение "Отряд технической службы федеральной противопожарной службы по Астраханской области"	2
Федеральное государственное казенное военное образовательное учреждение высшего профессионального образования "Пермский военный институт внутренних войск Министерства внутренних дел Российской Федерации"	2
государственное бюджетное учреждение здравоохранения Свердловской области "Свердловский областной центр по профилактике и борьбе со СПИД и инфекционными заболеваниями"	2
открытое акционерное общество "Чувашский государственный институт инженерно-технических изысканий"	2
муниципальное бюджетное общеобразовательное учреждение - Средняя общеобразовательная школа № 7 города Мценска	2
Местная администрация внутригородского муниципального образования Санкт-Петербурга муниципальный округ Введенский	2
Администрация Президента и Правительства Республики Дагестан	2
государственное бюджетное образовательное учреждение среднего профессионального образования Ставропольского края "Кисловодский медицинский колледж"	2
муниципальное бюджетное общеобразовательное учреждение средняя общеобразовательная школа № 5 муниципального образования Щербиновский район станица Старощербиновская	2
Государственное бюджетное учреждение здравоохранения города Москвы"Городская поликлиника №78 Департамента здравоохранения города Москвы"	2
федеральное казенное учреждение "Исправительная колония № 8 Главного управления Федеральной службы исполнения наказаний по Республике Коми"	2
Администрация муниципального образования Брюховецкий район	2
Государственное бюджетное учреждение "Пансионат ветеранов войны и труда"	2
Аппарат Государственного Собрания (Ил Тумэн) Республики Саха (Якутия)	2
Федеральное государственное бюджетное учреждение науки Институт автоматики и электрометрии Сибирского отделения Российской академии наук	2
Администрация муниципального образования "Рутульский район"	2
Министерство культуры Свердловской области	2
Администрация Пестяковского муниципального района Ивановской области	2
Муниципальное бюджетное общеобразовательное учреждение средняя общеобразовательная школа N 77	2
Местная Администрация муниципального образования муниципальный округ Посадский	2
федеральное казенное учреждение "Исправительная колония № 6 Управления Федеральной службы исполнения наказаний по Омской области"	2
Управление культуры администрации Саратовского муниципального района Саратовской области	2
Государственный комитет Республики Саха (Якутия) по размещению государственных заказов	2
Государственное бюджетное учреждение Республики Дагестан "Кизилюртовская центральная городская больница"	2
федеральное государственное казенное учреждение "Войсковая часть 35533"	2
Администрация Лежневского городского поселения Лежневского муниципального района Ивановской области	2
государственное бюджетное учреждение здравоохранения Астраханской области "Клинический родильный дом"	2
муниципальное бюджетное учреждение Басакинского сельского поселения Чернышковского муниципального района "Басакинское"	2
Муниципальное казенное учреждение Администрация муниципального образования город Нижний Тагил	2
Администрация Красногвардейского района Оренбургской области	2
федеральное казенное учреждение здравоохранения "Санаторий-профилакторий "Солнечный" внутренних войск Министерства внутренних дел Российской Федерации"	2
Государственное учреждение Центральная войсковая комендатура по материально-техническому обеспечению ГКВВ МВД России	2
Управление Министерства внутренних дел Российской Федерации по Калининградской области	2
Управление Министерства внутренних дел Российской Федерации по Чукотскому автономному округу	2
Администрация Нерльского городского поселения Тейковского муниципального района Ивановской области	2
Открытое акционерное общество "Российский Сельскохозяйственный банк"	2
муниципальное дошкольное образовательное учреждение "Детский сад N 30 "Сосенка"	2
Государственное бюджетное учреждение Республики Дагестан "Буйнакский межрайонный диагностический центр"	2
Муниципальное казенное учреждение городского округа Заречный "Дирекция единого заказчика"	2
Государственное бюджетное учреждение Республики Саха (Якутия) "Государственная противопожарная служба Республики Саха (Якутия)"	2
муниципальное образовательное учреждение средняя общеобразовательная школа № 79	2
Государственное учреждение - Управление Пенсионного фонда Российской Федерации в Солецком районе Новгородской области	2
Общество с ограниченной ответственностью "Госзаказчик.ру"	2
Управление Федеральной службы по надзору в сфере защиты прав потребителей и благополучия человека по Свердловской области	2
Администрация Мытищинского муниципального района	2
Администрация городского округа "город Южно-Сухокумск"	2
комитет здравоохранения Курской области	2
Федеральное бюджетное учреждение "Российский центр защиты леса"	2
Администрация Краснодарского края	2
муниципальное бюджетное общеобразовательное учреждение "Семиозерская основная общеобразовательная школа"	2
Открытое акционерное общество "Богдановичский комбикормовый завод"	2
Муниципальное казенное учреждение города Сочи "Управление капитального ремонта"	2
Администрация Приволжского муниципального района	2
Федеральное государственное бюджетное учреждение "Национальный парк "Русская Арктика"	2
Управление вневедомственной охраны при МВД по Чеченской Республике	2
муниципальное бюджетное дошкольное образовательное учреждение детский сад комбинированного вида № 56	2
Администрация Остаповского сельского поселения Шуйского муниципального района Ивановской области	2
Администрация Афипского городского поселения Северского района	2
Государственное бюджетное дошкольное образовательное учреждение детский сад № 144 присмотра и оздоровления Центрального района Санкт-Петербурга	2
Московско-Окское бассейновое водное управление Федерального агентства водных ресурсов	2
Общество с ограниченной ответственностью "АрбитражЮрФин консалтинг"	2
Волгоградская областная Дума	2
Местная Администрация Муниципального образования Муниципальный округ Дачное	1
Муниципальное бюджетное учреждение здравоохранения Ногликская центральная районная больница	1
министерство финансов Амурской области	1
Общество с ограниченной ответственностью "Универсал-торг"	1
федеральное государственное казенное учреждение "7 отряд федеральной противопожарной службы по Омской области"	1
Государственная инспекция труда в Хабаровском крае	1
Министерство промышленности и энергетики Чеченской Республики	1
Государственное бюджетное учреждение Республики Дагестан "Каспийская центральная городская больница"	1
федеральное государственное казенное образовательное учреждение высшего профессионального образования "Институт Федеральной службы безопасности Российской Федерации (г. Екатеринбург)"	1
Государственное бюджетное образовательное учреждение среднего профессионального образования Истринский профессиональный колледж Московской области	1
государственное учреждение - Управление Пенсионного фонда Российской Федерации в г.Волжске Республики Марий Эл	1
федеральное казенное учреждение "Краевая больница № 1 Главного управления Федеральной службы исполнения наказаний по Красноярскому краю"	1
Местная администрация муниципального образования муниципальный округ Коломна	1
муниципальное казенное учреждение муниципального образования Абинский район "Многофункциональный центр предоставления государственных и муниципальных услуг"	1
Краевое государственное казенное учреждение "Управление по делам гражданской обороны, чрезвычайным ситуациям и пожарной безопасности Хабаровского края"	1
Муниципальное казенное общеобразовательное учреждение "Черская средняя общеобразовательная школа" муниципального района "Нижнеколымский район"	1
отраслевой (функциональный) орган администрации Таштагольского муниципального района - муниципальное казенное учреждение "Управление образования администрации Таштагольского муниципального района"	1
государственное бюджетное образовательное учреждение начального профессионального образования "Профессиональное училище № 35"	1
Администрация муниципального образования сельского поселения "Илькинское" Заиграевского района Республики Бурятия	1
Муниципальное казенное учреждение образования "Управление по обеспечению деятельности образовательных учреждений Новосергиевского района Оренбургской области"	1
Государственное бюджетное дошкольное образовательное учреждение детский сад № 22 комбинированного вида Курортного района Санкт-Петербурга	1
Муниципальное бюджетное общеобразовательное учреждение - средняя общеобразовательная школа № 10 х.Новосадковский	1
федеральное государственное казенное военное образовательное учреждение высшего профессионального образования "Военная академия воздушно-космической обороны имени Маршала Советского Союза Г.К. Жукова" Министерства обороны Российской Федерации	1
государственное бюджетное образовательное учреждение дополнительного образования детей Воронежской области "Специализированная детско-юношеская спортивная школа олимпийского резерва по волейболу"	1
Государственное бюджетное учреждение здравоохранения "Брянская городская больница №4"	1
администрация муниципального образования Балтийского сельсовета Курского района Ставропольского края	1
Государственное казенное учреждение Краснодарского края "Автобаза органов государственной власти Краснодарского края"	1
Администрация Новогоряновского сельского поселения Тейковского муниципального района Ивановской области	1
Администрация Распопинского сельского поселения Клетского муниципального района Волгоградской области	1
муниципальное бюджетное учреждение здравоохранения "Городская поликлиника № 41 города Ростова-на-Дону"	1
Государственное казенное учреждение города Москвы "Дирекция заказчика жилищно-коммунального хозяйства и благоустройства Юго-Западного административного округа"	1
Администрация сельского поселения Квашёнковское Талдомского муниципального района Московской области	1
федеральное казенное учреждение "Исправительная колония № 10 Управления Федеральной службы исполнения наказаний по Тверской области"	1
Территориальная комиссия Пригородного района по делам несовершеннолетних и защите их прав	1
Управление Федеральной службы безопасности Российской Федерации по Алтайскому краю	1
государственое бюджетное учреждение здравоохранения Республики Башкортостан центральная Баймакская центральная городская больница	1
государственное бюджетное учреждение здравоохранения Новосибирской области "Кочковская центральная районная больница"	1
государственное казенное учреждение социального обслуживания Краснодарского края "Краевой психолого-методический центр"	1
государственное учреждение - Управление Пенсионного фонда Российской Федерации в городе Ханты-Мансийске Ханты-Мансийского автономного округа - Югры	1
федеральное государственное казенное образовательное учреждение "Первый пограничный кадетский корпус Федеральной службы безопасности Российской Федерации"	1
войсковая часть 44231	1
Открытое акционерное общество "Проектно-изыскательский и научно-исследовательский институт воздушного транспорта "Ленаэропроект"	1
Администрация муниципального района "Город Валуйки и Валуйский район" Белгородской области	1
федеральное казенное учреждение "Исправительная колония № 3 Управления Федеральной службы исполнения наказаний по Калужской области"	1
Государственное казенное учреждение "Шадринский областной наркологический диспансер"	1
федеральное казенное учреждение здравоохранения "Медико-санитарная часть Министерства внутренних дел Российской Федерации по Тульской области"	1
Федеральное государственное бюджетное учреждение детский туберкулезный санаторий "Кирицы" Министерства здравоохранения и социального развития Российской Федерации	1
следственное управление Следственного комитета Российской Федерации по Республике Татарстан	1
Отдел вневедомственной охраны Отдела Министерства внутренних дел Российской Федерации по городу Мегиону	1
Управление Пенсионного фонда Российской Федерации (государственное учреждение) в Киренском районе Иркутской области	1
Администрация Куликовского сельского поселения Калачинского муниципального района Омской области	1
Местная администрация внутригородского муниципального образования Санкт-Петербурга муниципального округа Балканский	1
Управление образования администрации МО "Жигаловский район"	1
Общество с ограниченной ответственностью "АСТ-Консалтинг-Специализированная организация"	1
Администрация Старощербиновского сельского поселения Щербиновского района	1
