министерство здравоохранения Новосибирской области	172
Муниципальное учреждение здравоохранения "Центральная городская больница г.Буйнакска"	77
Федеральное государственное бюджетное учреждение "Российский научно-исследовательский нейрохирургический институт имени профессора А. Л. Поленова" Министерства здравоохранения и социального развития Российской Федерации	56
Государственное бюджетное учреждение Республики Дагестан "Дирекция молодежных жилищно-строительных программ"	47
Общество с ограниченной ответственностью "Партнер"	37
федеральное казенное учреждение здравоохранения  "Центр восстановительной медицины и реабилитации "Зеленая роща" Министерства внутренних дел Российской Федерации"	36
Верховный Суд Республики Башкортостан	32
Общество с ограниченной ответственностью "Инфотрейд"	22
Управление муниципального заказа Администрации города Челябинска	18
Государственное бюджетное учреждение Республики Дагестан "Психоневрологический интернат "Милосердие"""	18
Государственное бюджетное учреждение Республики Дагестан "Буйнакская центральная городская больница"	17
Префектура Южного административного округа города Москвы	16
Государственное стационарное учреждение социального обслуживания Министерства труда и социального развития Республики Дагестан - Психоневрологический интернат "Милосердие"	15
администрация Шатурского муниципального района	15
федеральное государственное бюджетное образовательное учреждение высшего профессионального образования "Томский государственный университет систем управления и радиоэлектроники"	13
Краевое государственное бюджетное учреждение культуры "Государственный центр народного творчества Красноярского края"	13
Государственное  стационарное учреждение социального обслуживания Министерства труда и социального развития Республики Дагестан - Дом-интернат для престарелых и инвалидов "Казанищенский"	13
Государственный комитет Республики Башкортостан по размещению государственных заказов	13
МО "Хунзахский район"	12
Территориальное управление Федерального агентства по управлению государственным имуществом в Брянской области	12
Государственное бюджетное учреждение Республики Дагестан "Дом-интернат для престарелых и инвалидов "Казанищенский"	12
государственное бюджетное учреждение здравоохранения Республики Башкортостан Инфекционная клиническая больница № 4 города Уфа	12
федеральное казенное учреждение "5 отряд федеральной противопожарной службы Государственной противопожарной службы по Пермскому краю (договорной)"	11
Государственное казенное учреждение Республики Дагестан "Социально-реабилитационный центр для несовершеннолетних в муниципальном образовании "город Дербент"	11
Окружная администрация города Якутска	11
Муниципальное бюджетное учреждение "Управление жилищно-коммунального хозяйства города Буйнакска"	10
Местная администрация внутригородского муниципального образования Санкт-Петербурга муниципального округа Гагаринское	9
Федеральное государственное бюджетное учреждение науки "Институт токсикологии Федерального медико-биологического агентства"	9
федеральное бюджетное учреждение "Кадастровая палата" по Ленинградской области	9
комитет государственного заказа Правительства Хабаровского края	9
Муниципальное бюджетное общеобразовательное учреждение города Новосибирска "Средняя общеобразовательная школа № 76"	9
Краевое государственное бюджетное учреждение здравоохранения "Верхнебуреинский центр организации специализированных видов медицинской помощи" министерства здравоохранения Хабаровского края	9
государственное бюджетное учреждение Ростовской области "Наркологический диспансер"	8
Администрация Мостовского городского поселения Мостовского района Краснодарского края	8
Муниципальное бюджетное учреждение здравоохранения "Махачкалинский родильный дом №2"	8
Управление Федеральной службы по надзору в сфере защиты прав потребителей и благополучия человека по городу Санкт-Петербургу	8
Управление Пенсионного фонда Российской Федерации (государственное учреждение) в г. Кемерово и Кемеровском районе Кемеровской области (межрайонное)	8
Комитет по здравоохранению	8
Управление Министерства внутренних дел Российской Федерации по Камчатскому краю	8
Федеральное бюджетное учреждение здравоохранения "Центр гигиены и эпидемиологии в Приморском крае"	8
федеральное государственное бюджетное учреждение "Поликлиника Министерства сельского хозяйства Российской Федерации"	7
государственное областное бюджетное учреждение здравоохранения Солецкая центральная районная больница	7
Местная администрация муниципального образования Муниципальный округ Звездное	7
администрация городского поселения Федоровский	7
Государственное казенное учреждение Республики Дагестан "Республиканский психоневрологический диспансер"	7
Муниципальное учреждение Администрация города Орска	7
Общество с ограниченной ответственностью "Северо-Западный Удостоверяющий Центр"	7
местная Администрация муниципального образования муниципальный округ Сампсониевское	7
Администрация города Екатеринбурга	6
Администрация Абатского муниципального района	6
Государственное казенное учреждение Республики Дагестан "Агентство энергосбережения"	6
Министерство строительства и жилищно-коммунального хозяйства Республики Дагестан	6
муниципальное бюджетное общеобразовательное учреждение средняя общеобразовательная школа N 62	6
Государственное бюджетное учреждение Республики Дагестан "Буйнакский противотуберкулезный диспансер Министерства здравоохранения Республики Дагестан"	6
Государственное казенное учреждение Республики Дагестан "Республиканская психиатрическая больница г. Буйнакска"	6
Управление Министерства внутренних дел Российской Федерации по Приморскому району г. Санкт-Петербурга	5
федеральное государственное автономное научное учреждение "Центральный научно-исследовательский и опытно-конструкторский институт робототехники и технической кибернетики"	5
Муниципальное образовательное учреждение "Моркинская средняя (полная) общеобразовательная школа №1"	5
Администрация муниципального образования "Морозовское городское поселение Всеволожского муниципального района Ленинградской области"	5
Администрация городского округа город Воронеж	5
Муниципальное казенное образовательное учреждение школа-интернат для детей-сирот и детей, оставшихся без попечения родителей, "Кадеты Барабы" Барабинского района Новосибирской области	5
муниципальное казенное учреждение муниципального образования Щербиновский район "Служба строительного заказчика"	5
Федеральное государственное унитарное предприятие "Центральный научно-исследовательский институт конструкционных материалов "Прометей"	5
Управление Министерства внутренних дел Российской Федерации по Тульской области	5
Общество с ограниченной ответственностью Торговая Компания "Аркада"	4
Министерство здравоохранения Республики Дагестан	4
Муниципальное бюджетное общеобразовательное учреждение средняя общеобразовательная школа N72	4
Муниципальное учреждение "Комитет по управлению муниципальным имуществом Уйского муниципального района"	4
Муниципальное общеобразовательное учреждение "Коркатовский лицей"	4
Местная Администрация муниципального образования муниципального округа Аптекарский остров	4
Федеральное государственное бюджетное учреждение "Центральный научно-исследовательский институт травматологии и ортопедии имени Н.Н. Приорова" Министерства здравоохранения и социального развития Российской Федерации	4
Муниципальное казенное учреждение "Цунтаснаб"	4
Министерство внутренних дел по Чеченской Республике	4
Государственное бюджетное учреждение здравоохранения города Москвы "Московский научно-исследовательский институт организации здравоохранения и медицинской экологии Департамента здравоохранения города Москвы"	4
Государственное унитарное предприятие города Москвы "Гормедтехника"	4
Главное управление материальных ресурсов Челябинской области	4
общество с ограниченной ответственностью экспертно-консультационное бюро "Медиатор"	4
Администрация Новокачалинского сельского поселения Ханкайского муниципального района Приморского края	4
федеральное казенное учреждение "Исправительная колония № 25 Управления Федеральной службы исполнения наказаний по Кировской области"	4
министерство промышленности, торговли и развития предпринимательства Новосибирской области	3
Санкт-Петербургское государственное бюджетное учреждение здравоохранения "Бюро судебно-медицинской экспертизы"	3
УПРАВЛЕНИЕ ФЕДЕРАЛЬНОЙ СЛУЖБЫ РОССИЙСКОЙ ФЕДЕРАЦИИ ПО КОНТРОЛЮ ЗА ОБОРОТОМ НАРКОТИКОВ ПО РЕСПУБЛИКЕ ДАГЕСТАН	3
Российский фонд фундаментальных исследований	3
Муниципальное бюджетное общеобразовательное учреждение средняя общеобразовательная школа N 73	3
Отдел Министерства внутренних дел Российской Федерации по городу Железноводску	3
федеральное государственное унитарное предприятие "Строительно-монтажное управление №22 Федеральной службы исполнения наказаний"	3
Администрация Изобильненского муниципального района Ставропольского края	3
Отдел вневедомственной охраны Межмуниципального отдела Министерства внутренних дел Российской федерации "Чебаркульский" Челябинской области	3
Главное управление Министерства Российской Федерации по делам гражданской обороны, чрезвычайным ситуациям и ликвидации последствий стихийных бедствий по Тверской области	3
Местная администрация Муниципального образования Муниципального округа № 53	3
Администрация Гаврилово-Посадского муниципального района Ивановской области	3
Администрация муниципального района Похвистневский Самарской области	3
Муниципальное общеобразовательное учреждение "Шоруньжинская средняя (полная) общеобразовательная школа"	3
Главное управление Министерства внутренних дел Российской Федерации по Самарской области	3
Муниципальное казенное учреждение "Администрация Кулинского муниципального района" Республики Дагестан	3
Государственное бюджетное учреждение Республики Саха (Якутия) "Якутская городская больница №4"	3
Следственное управление Следственного комитета Российской Федерации по Иркутской области	3
муниципальное казенное учреждение "Администрация поселка Городищи Петушинского района Владимирской области"	3
муниципальное бюджетное дошкольное образовательное учреждение Центр развития ребенка - детский сад первой категории № 1 "Ромашка"	3
Муниципальное автономное учреждение "Центр лечебного и профилактического питания" городского округа город Уфа Республики Башкортостан	3
Местная администрация Муниципального образования Муниципальный округ Озеро Долгое	3
Администрация Калачевского городского поселения Калачевского муниципального района Волгоградской области	3
Администрация города Сергиев Посад Сергиево-Посадского муниципального района Московской области	3
Муниципальное бюджетное учреждение "Служба организации безопасности дорожного движения" городского округа "Город Калининград"	3
Федеральное государственное бюджетное учреждение науки Институт физической химии и электрохимии им. А.Н. Фрумкина Российской академии наук	3
управление делами Губернатора и Правительства Красноярского края	3
федеральное казенное учреждение здравоохранения "Центр восстановительной медицины и реабилитации "Озеро Долгое" Министерства внутренних дел Российской Федерации"	3
Министерство юстиции Республики Дагестан	3
федеральное государственное бюджетное образовательное учреждение высшего профессионального образования "Мичуринский государственный аграрный университет"	3
федеральное казенное учреждение "Исправительная колония № 1 Управления Федеральной службы исполнения наказаний по Чувашской Республике-Чувашии"	3
Муниципальное казенное учреждение "Служба единого заказчика Кемеровского муниципального района"	3
Местная Администрация внутригородского муниципального образования Санкт-Петербурга муниципального округа Константиновское	3
Санкт-Петербургское государственное бюджетное учреждение культуры "Государственный историко-художественный дворцово-парковый музей-заповедник "Гатчина"	3
Муниципальное бюджетное общеобразовательное учреждение средняя общеобразовательная школа N 41	3
Муниципальное казенное учреждение "Дирекция единого заказчика"	3
Администрация муниципального образования "Буйнакский район"	3
Администрация муниципального образования Крымский район	3
муниципальное бюджетное дошкольное образовательное учреждение детский сад общеразвивающего вида с приоритетным осуществлением деятельности по художественно-эстетическому направлению развития детей второй категории № 3 "Аленушка"	3
Местная администрация внутригородского Муниципального образования Санкт-Петербурга муниципальный округ Московская застава	3
Государственное бюджетное учреждение здравоохранения Калининградской области "Городская станция скорой медицинской помощи"	2
Федеральное государственное образовательное учреждение среднего профессионального образования "Петровский колледж"	2
Федеральное бюджетное учреждение науки "Екатеринбургский медицинский - научный центр профилактики и охраны здоровья рабочих промпредприятий" Федеральной службы по надзору в сфере защиты прав потребителей и благополучия человека	2
Юго-Западная база хранения ресурсов (филиал) федерального казенного учреждения "Северо-Кавказское окружное управление материально-технического снабжения Министерства внутренних дел Российской Федерации"	2
Областное казенное учреждение здравоохранения особого типа "Курский областной медицинский центр мобилизационных резервов "Резерв"	2
Администрация Белгородского района	2
федеральное казенное учреждение "Исправительная колония № 14 Управления Федеральной службы исполнения наказаний по Ханты-Мансийскому автономному округу - Югре"	2
администрация муниципального образования "Высоцкое городское поселение" Выборгского района Ленинградской области	2
Муниципальное бюджетное общеобразовательное учреждение средняя общеобразовательная школа N 6	2
Муниципальное бюджетное общеобразовательное учреждение средняя общеобразовательная школа N 9	2
Краевое государственное казенное учреждение "Кербинское лесничество"	2
Управление образования администрации Курахского района	2
Местная администрация города Зеленогорска	2
