Государственное бюджетное учреждение Курганской области "Курганский лесопожарный центр"	1
федеральное государственное бюджетное учреждение "Управление мелиорации земель и сельскохозяйственного водоснабжения по Республике Татарстан"	1
Государственное учреждение социального обслуживания Булунский центр социально-бытового обслуживания"	1
администрация Безменовского сельсовета Черепановскогорайона Новосибирской области	1
Муниципальное бюджетное дошкольное образовательное учреждение детский сад комбинированного вида № 34	1
государственное учреждение-Управление Пенсионного фонда Российской Федерации по г. Кисловодску Ставропольского края	1
администрация Находкинского городского округа	1
государственное учреждение - Управление Пенсионного фонда Российской Федерации в Бологовском районе Тверской области	1
Управление социальной защиты населения Троицкого и Новомосковского административных округов города Москвы	1
Государственное учреждение - Управление Пенсионного фонда Российской Федерации в Петровском районе Саратовской области	1
Новороссийская больница Федерального государственного бюджетного учреждения здравоохранения "Южный окружной медицинский центр Федерального медико-биологического агентства"	1
Федеральное государственное бюджетное учреждение науки Институт химии и химической технологии Сибирского отделения Российской академии наук	1
Учреждение Российской академии наук Физико-технический институт им. А.Ф. Иоффе РАН	1
Нефтеюганское районное муниципальное дошкольное образовательное бюджетное учреждение "Детский сад комбинированного вида "Солнышко"	1
федеральное государственное бюджетное образовательное учреждение высшего профессионального образования "Тольяттинский государственный университет"	1
Администрация Богородского района Нижегородской области	1
Кировское областное государственное казенное учреждение Центр занятости населения города Кирова	1
Муниципальное бюджетное образовательное учреждение дополнительного образования детей "Детская музыкальная школа №2" г. Пензы	1
государственное бюджетное образовательное учреждение дополнительного образования детей Воронежской области "Специализированная детско-юношеская спортивная школа олимпийского резерва № 33"	1
государственное бюджетное учреждение культуры "Научно-производственный центр по охране, учету и реставрации памятников истории и культуры Калининградской области"	1
Управление Федеральной службы государственной регистрации, кадастра и картографии по Краснодарскому краю	1
Федеральное государственное бюджетное учреждение "Дагестанский республиканский центр по гидрометеорологии и мониторингу окружающей среды"	1
государственное бюджетное учреждение здравоохранения "Медицинский информационно-аналитический центр" департамента здравоохранения Краснодарского края	1
муниципальное казенное образовательное учреждение "Ляпичевская средняя общеобразовательная школа" Калачевского муниципального района Волгоградской области	1
Управление по размещению муниципального заказа Администрации города Димитровграда Ульяновской области	1
отдел федерального казенного учреждения "Управление по обеспечению деятельности оперативных подразделений Федеральной службы исполнения наказаний" по Карачаево-Черкесской Республике	1
федеральное казенное учреждение "Жилищно-коммунальное управление Главного управления Федеральной службы исполнения наказаний по Новосибирской области"	1
Центр специальной связи и информации Федеральной службы охраны Российской Федерации в Челябинской области	1
МО "сельсовет Батлаичинский" Хунзахского района	1
федеральное государственное казенное учреждение "Пограничное управление Федеральной службы безопасности Российской Федерации по Кабардино-Балкарской Республике"	1
Федеральное бюджетное учреждение здравоохранения "Центр гигиены и эпидемиологии в Мурманской области"	1
Санкт-Петербургское государственное бюджетное учреждение здравоохранения "Детская городская поликлиника № 68"	1
Управление Федеральной службы Российской Федерации по контролю за оборотом наркотиков по Ивановской области	1
Конкурсное агентство Калининградской области	1
федеральное государственное казенное учреждение "4 Центральный научно-исследовательский институт" Министерства обороны Российской Федерации	1
государственное бюджетное учреждение Архангельской области "Региональная транспортная служба"	1
Администрация Таманского сельского поселения Темрюкского района	1
Федеральное казенное образовательное учреждение среднего профессионального образования "Оренбургский государственный экономический колледж-интернат" Министерства труда и социальной защиты Российской Федерации	1
Санкт-Петербургское государственное бюджетное образовательное учреждение дополнительного образования детей "Детская музыкальная школа № 22"	1
Управление Судебного департамента в Пензенской области	1
Государственное казенное учреждение Волгоградской области "Жирновское лесничество"	1
Администрация поселения Ботановское	1
Государственное автономное учреждение здравоохранения "Республиканский клинический противотуберкулезный диспансер"	1
Муниципальное учреждение культуры "Районный организационно-методический центр" Саратовского муниципального района Саратовской области	1
муниципальное бюджетное дошкольное образовательное учреждение детский сад общеразвивающего вида с приоритетным осуществлением деятельности по художественно-эстетическому направлению развития детей "Алёнушка"	1
государственное казенное образовательное учреждение для детей-сирот и детей оставшихся без попечения родителей, специальный (коррекционный) детский дом для детей с ограниченными возможностями здоровья "Рождественский" Краснодарского края	1
МО "село Орота" Хунзахского района	1
муниципальное бюджетное дошкольное образовательное учреждение муниципального образования город Краснодар "Детский сад комбинированного вида № 128"	1
государственное казенное образовательное учреждение Ростовской области для детей-сирот и детей, оставшихся без попечения родителей, детский дом №3 г.Шахты	1
государственное бюджетное стационарное учреждение социального обслуживания Московской области "Социально-оздоровительный центр "Акрихин-Здоровье"	1
Государственное учреждение здравоохранения города Москвы "Станция переливания крови Департамента здравоохранения города Москвы"	1
Учреждение Российской академии наук Институт проблем безопасного развития атомной энергетики РАН	1
Следственное управление Следственного комитета Российской Федерации по Ленинградской области	1
Министерство здравоохранения Республики Татарстан	1
Муниципальное общеобразовательное учреждение "Бебелевская средняя общеобразовательная школа" муниципального района "Ферзиковский район" Калужской области	1
Муниципальное казенное учреждение "Автовский Центр благоустройства и социального развития"	1
Челябинский областной суд	1
государственное бюджетное учреждение Ростовской области "Специализированная больница восстановительного лечения № 2" в г. Новошахтинске	1
Объединенный Арктический авиационный отряд Федеральной службы безопасности Российской Федерации	1
муниципальное бюджетное общеобразовательное учреждение "Коробицынская средняя общеобразовательная школа"	1
Государственное бюджетное учреждение здравоохранения города Москвы "Научно-исследовательский институт скорой помощи им. Н.В. Склифосовского Департамента здравоохранения города Москвы"	1
Управление Федеральной службы безопасности Российской Федерации по Мурманской области	1
Государственное бюджетное специальное (коррекционное) образовательное учреждение для обучающихся, воспитанников с ограниченными возможностями здоровья специальная (коррекционная) общеобразовательная школа (VIII вида) № 18 Центрального района Санкт-Петербурга	1
Государственное бюджетное учреждение Курганской области "Многофункциональный центр по предоставлению государственных и муниципальных услуг"	1
Федеральное государственное образовательное учреждение среднего профессионального образования "Новороссийский колледж радиоэлектронного приборостроения"	1
Федеральное государственное бюджетное учреждение "Государственный научный центр "Институт иммунологии" Федерального медико-биологического агентства	1
муниципальное образовательное учреждение "Селивановская средняя образовательная школа № 28"	1
Управление Пенсионного фонда Российской Федерации (государственное учреждение) в городе Щекино и Щекинском районе Тульской области	1
Эксплуатационно-технический центр при Министерстве внутренних дел по Республике Башкортостан	1
Государственное бюджетное учреждение Республики Дагестан "Республиканская офтальмологическаябольница им. Х.П.Булача"	1
муниципальное бюджетное дошкольное образовательное учреждение детский сад комбинированного вида №62 "Журавушка"	1
Департамент экономики Орловской области	1
администрация Новоалександровского муниципального района Ставропольского края	1
Управление Министерства внутренних дел Российской Федерации по Оренбургской области	1
Управление по обеспечению деятельности мировых судей в Курганской области	1
Аппарат Государственной Думы Федерального Собрания Российской Федерации	1
Федеральное бюджетное учреждение науки "Северо-Западный научный центр гигиены и общественного здоровья"	1
федеральное казенное учреждение "Центр хозяйственного и сервисного обеспечения Министерства внутренних дел по Республике Башкортостан"	1
Муниципальное учреждение "Спортивно-оздоровительный центр "Луч"	1
Государственное бюджетное учреждение здравоохранения города Москвы "Городская клиническая больница № 51 Департамента здравоохранения города Москвы"	1
бюджетное учреждение здравоохранения Удмуртской Республики "Первая республиканская клиническая больница Министерства здравоохранения Удмуртской Республики"	1
Управление Министерства внутренних дел Российской Федерации по городу Сургуту	1
Муниципальное бюджетное дошкольное образовательное учреждение детский сад общеразвивающего вида с приоритетным осуществлением деятельности по познавательно-речевому направлению развития детей № 20 "Зоренька"	1
комитет по управлению имуществом администрации городского округа "Город Чита"	1
Государственное бюджетное общеобразовательное учреждение средняя общеобразовательная школа № 411 "Гармония" с углубленным изучением английского языка Петродворцового района Санкт-Петербурга	1
федеральное казенное учреждение здравоохранения "Санаторий "Лесное озеро" Министерства внутренних дел Российской Федерации"	1
Муниципальное бюджетное дошкольное образовательное учреждение - детский сад комбинированного вида № 50 "Тополек" г. Балаково Саратовской области	1
Государственное бюджетное дошкольное образовательное учреждение детский сад № 13 общеразвивающего вида с приоритетным осуществлением познавательно-речевого развития воспитанников Петродворцового района Санкт-Петербурга	1
Администрация муниципального образования "Шамильский район"	1
Администрация Российского сельского поселения Вяземского района Смоленской области	1
государственное учреждение - Управление Пенсионного фонда Российской Федерации в Зубцовском районе Тверской области	1
Общество с ограниченной ответственностью "Стройком-97"	1
федеральное казенное учреждение "Уголовно-исполнительная инспекция  Главного управления Федеральной службы исполнения наказаний по Республике Башкортостан"	1
государственное учреждение - Управление Пенсионного фонда Российской Федерации в Пестречинском районе Республики Татарстан	1
Муниципальное бюджетное общеобразовательное учреждение лицей N 82	1
Администрация Крапивновского сельского поселения Тейковского муниципального района Ивановской области	1
Главное управление государственного заказа Смоленской области	1
государственное бюджетное учреждение социального обслуживания Краснодарского края "Усть-Лабинский комплексный центр социального обслуживания населения "Рассвет"	1
департамент экономического развития, промышленности и торговли Костромской области	1
Местная администрация муниципального образования муниципальный округ Рыбацкое	1
Администрация Хасанского муниципального района	1
Местная администрация муниципального образования муниципальный округ N 7	1
государственное казенное учреждение Краснодарского края "Краснодарская краевая аварийно-спасательная служба "Кубань-СПАС"	1
муниципальное бюджетное учреждение здравоохранения Городская клиническая больница № 3	1
Межрайонная инспекция Федеральной налоговой службы № 5 по Оренбургской области	1
Государственное учреждение города Москвы "Управление здравоохранения Юго-Западного административного округа города Москвы" Департамента здравоохранения города Москвы	1
федеральное государственное казенное учреждение "Войсковая часть 54729"	1
Департамент финансов Администрации городского округа Самара	1
Государственное бюджетное учреждение здравоохранения Сахалинской области "Городская поликлиника № 7 города Южно-Сахалинска"	1
Управление Федеральной службы безопасности Российской Федерации по Республике Карелия	1
Федеральное бюджетное учреждение "Государственный региональный центр стандартизации, метрологии и испытаний в Нижегородской области"	1
Федеральное бюджетное учреждение здравоохранения "Центр гигиены и эпидемиологии в Ульяновской области"	1
Государственное учреждение "Отряд технической службы федеральной противопожарной службы по Ульяновской области"	1
Межрайонная инспекция Федеральной налоговой службы № 3 по Курганской области	1
Муниципальное казенное учреждение "Управление образованием города Буйнакска"	1
Отдел Министерства внутренних дел Российской Федерации по Щербиновскому району (дислокация ст.Старощербиновская)	1
администрация муниципального образования Кореновский район	1
Межрайонное отделение вневедомственной охраны отдела Министерства внутренних дел Российской Федерации по Левашинскому району	1
федеральное государственное учреждение "Аналитический центр при Правительстве Российской Федерации"	1
Государственное бюджетное учреждение здравоохранения города Москвы "Диагностический клинический центр № 1 Департамента здравоохранения города Москвы"	1
