федеральное государственное учреждение "Государственный научно-исследовательский институт информационных технологий и телекоммуникаций"	1
муниципальное казенное дошкольное образовательное учреждение города Новосибирска "Детский сад № 426 комбинированного вида"	1
Муниципальное бюджетное дошкольное образовательное учреждение детский сад № 13 "Журавушка" с корпусом № 2 "Чебурашка"	1
Федеральное бюджетное учреждение здравоохранения "Центр гигиены и эпидемиологии в Саратовской области"	1
Муниципальное учреждение здравоохранения "Кабанская центральная районная больница"	1
Государственное бюджетное учреждение "Редакция газеты "Рассвет"	1
Чебоксарский городской комитет по управлению имуществом	1
Муниципальное дошкольное образовательное учреждение детский сад №38 комбинированного вида	1
Санкт-Петербургское государственное бюджетное образовательное учреждение дополнительного образования детей "Детская художественная школа № 3"	1
федеральное казенное учреждение "Центр хозяйственного и сервисного обеспечения Управления Министерства внутренних дел Российской Федерации по Вологодской области"	1
Федеральное государственное бюджетное учреждение "Новосибирский научно-исследовательский институт травматологии и ортопедии" Министерства здравоохранения и социального развития Российской Федерации	1
Администрация муниципального образования Тихорецкий район	1
Государственное учреждение здравоохранения "Абалахский республиканский Центр восстановительной медицины и реабилитации" Министерства здравоохранения Республики Саха (Якутия)	1
Местная Администрация муниципального образования муниципальный округ Владимирский округ	1
Муниципальное общеобразовательное учреждение "Талицкая средняя общеобразовательная школа N 1"	1
Администрация муниципального образования Кандалакшский район	1
Махачкалинский филиал федерального государственного бюджетного образовательного учреждения высшего профессионального образования "Московский автомобильно-дорожный государственный технический университет (МАДИ)"	1
Департамент жилищно-коммунального хозяйства и энергетики города Ростова-на-Дону	1
Государственное образовательное учреждение "Учебно-методический центр по информационно-аналитической работе"	1
Департамент физической культуры и спорта города Москвы	1
Комитет по народному образованию администрации Солнечногорского муниципального района	1
Войсковая часть 3701	1
федеральное казенное учреждение "Исправительная колония № 6 Управления Федеральной службы исполнения наказаний по Республике Марий Эл"	1
Федеральное государственное унитарное предприятие "СВЯЗЬ - безопасность"	1
Управление по размещению государственного заказа Пензенской области	1
Администрация Кинешемского муниципального района	1
Администрация муниципального образования Орловский сельсовет Кировского района Ставропольского края	1
государственное бюджетное учреждение Краснодарского края "Павловская зональная ветеринарная лаборатория"	1
Федеральное бюджетное учреждение науки "Омский научно-исследовательский институт природно-очаговых инфекций"	1
федеральное казенное лечебно-профилактическое учреждение "Областная туберкулезная больница № 1 Управления Федеральной службы исполнения наказаний по Саратовской области"	1
Государственное бюджетное образовательное учреждение Республики Марий Эл "Центр психолого-педагогической реабилитации и коррекции, подготовки семей для принятия детей и их профессионального сопровождения "Детство"	1
Администрация муниципального образования Сосновское сельское поселение муниципального образования Приозерский муниципальный район Ленинградской области	1
Комитет по транспорту	1
Управление по размещению заказа для муниципальных нужд администрации муниципального образования город Краснодар	1
администрация муниципального образования села Рагули Апанасенковского района Ставропольского края	1
Открытое акционерное общество "Головной проектный институт гражданского строительства, планировки и застройки городских и сельских поселений Чувашской Республики "Чувашгражданпроект"	1
комитет государственного заказа Тульской области	1
Муниципальное бюджетное дошкольное образовательное учреждение детский сад "Росинка"	1
Префектура Юго-Восточного административного округа города Москвы	1
Следственное управление Следственного комитета Российской Федерации по Челябинской области	1
государственное учреждение - Управление Пенсионного фонда Российской Федерации по городу-курорту Кисловодску Ставропольского края	1
Вятский район водных путей и судоходства -филиал Федерального бюджетного учреждения "Волжское государственное бассейновое управление водных путей и судоходства"	1
Инспекция Федеральной налоговой службы по г. Смоленску	1
Муниципальное бюджетное учреждение здравоохранения Городская клиническая больница № 3	1
Местная Администрация Муниципального образования поселок Александровская	1
государственное казенное учреждение Республиканский центр по обеспечению граждан средствами реабилитации и санаторно-курортными путевками	1
Муниципальное учреждение "Администрация Паницкого муниципального образования Красноармейского муниципального района Саратовской области"	1
федеральное казенное учреждение "Лечебное исправительное учреждение № 4 Управления Федеральной службы исполнения наказаний по Удмуртской Республике"	1
управление социальной защиты населения Целинского района Ростовской области	1
Министерство здравоохранения Московской области	1
муниципальное казенное учреждение культуры "Культурно-досуговый центр" муниципального образования Степновского сельсовета Степновского района Ставропольского края	1
администрация муниципального образования город Новоалександровск Новоалександровского района Ставропольского края	1
федеральное бюджетное учреждение "Кадастровая палата" по Республике Башкортостан	1
муниципальное казенное общеобразовательное учреждение гимназия "Еврогимназия"	1
Муниципальное учреждение здравоохранения "Центральная районная больница" Матвеево-Курганского района Ростовской области	1
Администрация муниципального образования "Багратионовское городское поселение"	1
муниципальное бюджетное учреждение "Центр муниципальных информационных ресурсов и технологий"	1
Федеральное государственное унитарное предприятие "Предприятие по производству бактерийных и вирусных препаратов Института полиомиелита и вирусных энцефалитов им. М.П.Чумакова РАМН"	1
Администрация Ретюнского сельского поселения Лужского муниципального района Ленинградской области	1
Муниципальное учреждение здравоохранения "Центральная районная больница" Усманского района Липецкой области	1
федеральное государственное казенное образовательное учреждение высшего профессионального образования "Краснодарский университет Министерства внутренних дел Российской Федерации"	1
Правительство Нижегородской области	1
муниципальное бюджетное общеобразовательное учреждение средняя общеобразовательная школа № 13 муниципального образования Щербиновский район поселок Щербиновский	1
государственное бюджетное образовательное учреждение среднего профессионального образования Архангельской области "Березниковский индустриальный техникум"	1
департамент по охране и использованию культурного наследия (памятников истории и культуры) Чеченской Республики министерства культуры Чеченской Республики	1
Управление записи актов гражданского состояния Краснодарского края	1
Государственное бюджетное учреждение здравоохранения города Москвы "Родильный дом № 15 Департамента здравоохранения города Москвы"	1
Министерство образования Пермского края	1
Муниципальное бюджетное учреждение "Отдел капитального строительства администрации городского округа "город Избербаш"	1
Управление Судебного департамента в Краснодарском крае	1
Государственное учреждение здравоохранения города Москвы "Городская больница № 49 Управления здравоохранения Юго-Восточного административного округа города Москвы"	1
муниципальное бюджетное дошкольное образовательное учреждение центр развития ребенка - детский сад № 9 муниципального образования Щербиновский район станица Старощербиновская	1
комитет по развитию инфраструктуры администрации городского округа "Город Чита"	1
Федеральное государственное казенное учреждение "Войсковая часть 71330"	1
Государственное бюджетное учреждение социального обслуживания населения Свердловской области "Комплексный центр социального обслуживания населения Артемовского района"	1
Администрация городского поселения поселок Поназырево Поназыревского муниципального района Костромской области	1
федеральное казенное учреждение "Исправительная колония № 5 Управления Федеральной службы исполнения наказаний по Калужской области"	1
муниципальное бюджетное дошкольное образовательное учреждение "Центр развития ребёнка - детский сад "Родничок"	1
Администрация Долдыканского сельсовета	1
Открытое акционерное общество "Издательско-полиграфическое предприятие "Уральский рабочий"	1
муниципальное бюджетное общеобразовательное учреждение "Средняя общеобразовательная школа № 1"	1
Государственное бюджетное учреждение здравоохранения Пермского края "Краевой противотуберкулезный диспансер N9"	1
администрация Ногинского муниципального района Московской области	1
федеральное государственное казенное учреждение "Войсковая часть 45187"	1
государственное бюджетное учреждение здравоохранения Республики Башкортостан Городская больница города Салават	1
муниципальное бюджетное общеобразовательное учреждение гимназия № 76 Ворошиловского района города Ростова-на-Дону	1
Управление по размещению госзаказа Липецкой области	1
Муниципальное бюджетное учреждение "Центральная городская больница" города Железнодорожного	1
Следственный комитет Российской Федерации	1
Департамент комплексного развития курортов и туризма Краснодарского края	1
Министерство внутренних дел по Республике Дагестан	1
муниципальное бюджетное дошкольное образовательное учреждение центр развития ребенка - детский сад № 5 муниципального образования Щербиновский район станица Старощербиновская	1
Федеральное государственное учреждение культуры "Государственный Эрмитаж"	1
Муниципальное казенное учреждение "Управление имущественных и земельных отношений городского округа "город Буйнакск"	1
Муниципальное учреждение Администрация Чепецкого сельского поселения Зуевского района Кировской области	1
Управление Федеральной службы исполнения наказаний по Сахалинской области	1
Управление образованием администрации муниципального образования Тбилисский район	1
Государственное бюджетное дошкольное образовательное учреждение детский сад № 27 общеразвивающего вида Петродворцового района Санкт-Петербурга	1
Администрация городского поселения - город Богучар Богучарского муниципального района Воронежской области	1
Государственное бюджетное учреждение здравоохранения города Москвы "Медико-санитарная часть №51 Департамента здравоохранения города Москвы"	1
Администрация города Ноябрьска	1
Санкт-Петербургское государственное бюджетное учреждение здравоохранения "Городская больница №15"	1
Администрация муниципального образования Абинский район	1
Администрация Локомотивного городского округа Челябинской области	1
государственное бюджетное учреждение здравоохранения Архангельской области "Первая городская клиническая больница имени Е.Е. Волосевич"	1
Межрайонная инспекция Федеральной налоговой службы № 10 по Красноярскому краю	1
Управление Пенсионного фонда Российской Федерации (государственное учреждение) в Успенском районе Краснодарского края	1
муниципальное бюджетное учреждение здравоохранения "Центральная районная больница" администрации муниципального образования Павловский район	1
федеральное казенное учреждение "Жилищно-коммунальное управление Управления Федеральной службы исполнения наказаний по г. Санкт-Петербургу и Ленинградской области"	1
Хозяйственное управление при Кабинете Министров Республики Татарстан	1
Муниципальное казеннное учреждение культуры "Централизованная библиотечная система Златоустовского городского округа"	1
Государственное бюджетное дошкольное образовательное учреждение детский сад № 112 комбинированного вида Выборгского района Санкт-Петербурга	1
Муниципальное бюджетное учреждение здравоохранения "Чайковская центральная городская больница"	1
федеральное казенное учреждение "Жилищно-коммунальное управление Управления Федеральной службы исполнения наказаний по Рязанской области"	1
федеральное казенное учреждение "Исправительная колония № 2 Главного управления Федеральной службы исполнения наказаний по Нижегородской области"	1
государственное бюджетное образовательное учреждение дополнительного образования детей Воронежской области "Специализированная детско-юношеская спортивная школа олимпийского резерва по футболу "Факел"	1
муниципальное бюджетное общеобразовательное учреждение Авило-Успенская средняя общеобразовательная школа	1
муниципальное казенное образовательное учреждение "Средняя общеобразовательная школа № 3 г. Калача-на-Дону" Калачевского муниципального района Волгоградской области	1
Администрация муниципального образования муниципального округа Светлановское	1
Государственное учреждение ветеринарии Московской области "Лотошинская районная станция по борьбе с болезнями животных"	1
Федеральное государственное учреждение "Научно-исследовательский центр курортологии и реабилитации Федерального медико-биологического агентства"	1
Калининградский филиал федерального государственного бюджетного образовательного учреждения высшего профессионального образования "Санкт-Петербургский Государственный аграрный университет"	1
Муниципальное образовательное учреждение "Моркинская средняя (полная) общеобразовательная школа №2"	1
Общество с ограниченной ответственностью "Центр конкурсных технологий"	1
Комитет по управлению имуществом Озерского муниципального района	1
Муниципальное общеобразовательное учреждение "Моркинская средняя (полная) общеобразовательная школа №6"	1
федеральное казенное учреждение "Исправительная колония № 3 Управления Федеральной службы исполнения наказаний по Тамбовской области"	1
